leelaz_opencl_tuning
0;XgemmBatched;192;100;192;16; -DKWG=32 -DKWI=8 -DMDIMA=8 -DMDIMC=8 -DMWG=64 -DNDIMB=8 -DNDIMC=8 -DNWG=64 -DSA=1 -DSB=0 -DSTRM=1 -DSTRN=0 -DVWM=4 -DVWN=8;OpenCL: NVIDIA Corporation Tesla K80 @ 823MHz
0;XgemmBatched;224;100;224;16; -DKWG=16 -DKWI=8 -DMDIMA=8 -DMDIMC=8 -DMWG=32 -DNDIMB=8 -DNDIMC=8 -DNWG=64 -DSA=0 -DSB=1 -DSTRM=0 -DSTRN=1 -DVWM=4 -DVWN=4;OpenCL: NVIDIA Corporation Tesla K80 @ 823MHz
0;XgemmBatched;256;100;256;16; -DKWG=32 -DKWI=8 -DMDIMA=16 -DMDIMC=8 -DMWG=64 -DNDIMB=16 -DNDIMC=8 -DNWG=64 -DSA=0 -DSB=1 -DSTRM=0 -DSTRN=0 -DVWM=4 -DVWN=4;OpenCL: NVIDIA Corporation Tesla K80 @ 823MHz
